{
  "$schema": "../../core/job.schema.json",
  "schema_version": "job-v1",
  "id": "regenic-t6-hero",
  "subject": {
    "product_name": "BPC-157 + TB-500",
    "dose_clause": "below it the dose '10MG/4ML' in Montserrat SemiBold navy, rendered EXACTLY as given; "
  },
  "spec": {
    "prompt_template": "Photorealistic e-commerce hero render of a small clear glass injection vial with a glossy navy-blue aluminium crimp flip-cap and clear liquid. Match the attached reference image EXACTLY for vial shape, blue crimp cap, glass, label shape and placement, materials and lighting — change ONLY the printed label text. BACKGROUND seamless very-light grey, soft key top-left, vial vertically centered, soft contact shadow. The white label on the lower body carries, left-aligned, NAVY text: the 'Regenic|Lab' wordmark navy #1b2846 with cyan leaf; the product name '{product_name}' in Montserrat SemiBold navy (largest); {dose_clause}then a small muted-grey line 'SC · Multidose Vial' in Montserrat Medium #5b687b. TYPOGRAPHY DISCIPLINE: replicate reference sizes/spacing exactly, modest, legible, do not enlarge; if no dose specified do NOT invent one. There is NO schedule badge. No 'Novecy' or third-party branding. Clean premium clinical pharmacy, sharp focus, sRGB. Portrait 934x1066.",
    "cad": "CAD source of truth: config/cad/T6_hero.json (regenic Norwood-Ludwig template T6 — glass multidose vial hero). Sole SKU wolverine-stack (Section 21, no badge); this config carries the T6 example SKU (BPC-157 + TB-500)."
  },
  "reference": { "image": "reference/t6-target.png", "optional": true },
  "output": {
    "imgtype": "hero",
    "aspect_ratio": "1:1",
    "resolution": "2k",
    "count": 1
  },
  "engine": { "name": "higgsfield", "model": "gpt_image_2" }
}
