{
  "$schema": "../../core/job.schema.json",
  "schema_version": "job-v1",
  "id": "joga-hairbands-edit-remove-element",
  "subject": {
    "operation": "remove_element"
  },
  "spec": {
    "prompt_template": "Re-render reference image 1 in place. Lock the child, hairband, hands, pose, lighting, background and kit colours exactly.\n\nONLY CHANGES:\n1. Remove completely the Joma J element from the jersey chest.\n2. Remove completely the white swoosh element from the jersey chest.\n3. Reconstruct plain royal-blue jersey fabric with natural weave and lighting where the removed elements were.\n\nDo not crop the product. Do not alter anything else.",
    "negative": "joma_j, white_swoosh, crop_product"
  },
  "reference": [
    { "image": "reference/parent-shot-1-base.png", "optional": true }
  ],
  "output": {
    "imgtype": "edit",
    "resolution": "2k",
    "count": 1
  },
  "engine": { "name": "higgsfield", "model": "nano_banana_2" }
}
