{
  "$schema": "../../core/job.schema.json",
  "schema_version": "job-v1",
  "id": "joga-hairbands-starz-kid-campaign",
  "subject": {
    "campaign": "Starz Kid",
    "audience": "youth_athletics",
    "mood": "energetic"
  },
  "spec": {
    "prompt_template": "Studio lifestyle photograph for the JOGA Starz Kid campaign: a young athlete aged 10-13 wearing a royal-blue JOGA hairband, the product clearly visible on the head. The band region must remain unoccluded and read as royal blue with the white JOGA wordmark legible (scene lock: band_visibility). Eye-level medium-close camera, soft key and fill lighting, energetic youth-athletics mood, studio lifestyle style.",
    "cad": "Campaign source of truth: knowledge/campaigns/starz-kid.json (creative-spec-v2, id starz-kid-hairbands) over knowledge/products/hairbands.json. Scene locks: band_region unoccluded, band_color royal_blue."
  },
  "reference": { "image": "reference/flatlay.png", "optional": true },
  "output": {
    "imgtype": "hero",
    "aspect_ratio": "4:3",
    "resolution": "2k",
    "count": 1,
    "background": "neutral studio grey backdrop",
    "composition": "subject centered, band readable, chest mark optional"
  },
  "engine": { "name": "higgsfield", "model": "nano_banana_2" }
}
