{
  "$schema": "../../core/job.schema.json",
  "schema_version": "job-v1",
  "id": "joga-hairbands-edit-subject-swap",
  "subject": {
    "view": "kid hero on pitch, royal blue hairband with white JOGA, both hands at temples adjusting band, smiling, dark stadium bokeh — match reference image 1 exactly"
  },
  "spec": {
    "prompt_template": "Re-render this exact image from reference image 1. Lock the exact camera angle, crop, pose, hand placement at temples, hairband position, blue band colour, lighting, and background bokeh.\n\nONLY CHANGES:\n1. Replace the model with a CHILD aged 10-13 — short brown hair (NOT bald), smooth skin, no facial hair, child-proportioned face and hands in the same pose.\n2. Jersey chest mark: use the STARZ S-crest from reference image 3 (blue) — small on chest. NO JOGA wordmark on jersey, NO crown, NO GA badge.\n\nMatch hairband product geometry from reference image 2 (royal blue band, white JOGA on band):\n\n{cad}\n\nVIEW: {view}.",
    "cad": "Elastic athletic hairband, continuous woven loop, royal blue, matte finish, 25mm band width, ~480mm circumference, white JOGA wordmark centered on the band face. Preserve geometry, material and proportions (source: knowledge/products/hairbands.json).",
    "negative": "adult model, bald child, facial hair, JOGA wordmark on jersey, crown badge, GA badge"
  },
  "reference": [
    { "image": "reference/parent-shot-1-base.png", "optional": true },
    { "image": "reference/flatlay.png", "optional": true },
    { "image": "reference/starz-s-crest-blue.png", "optional": true }
  ],
  "output": {
    "imgtype": "edit",
    "resolution": "2k",
    "count": 1
  },
  "engine": { "name": "higgsfield", "model": "nano_banana_2" }
}
