{
  "$schema": "../../core/job.schema.json",
  "schema_version": "job-v1",
  "id": "primi-toughkey-plate-plan",
  "subject": { "view": "top-down plan view, flat top face square to camera, long axis horizontal" },
  "spec": {
    "cad": "cad.md",
    "prompt_template": "Clean studio product photograph, a single USB-C contactless hardware security key isolated on a seamless neutral light-grey (#d9d9dd) background. VIEW: {view} — show the full top face: molded keyring through-slot at the left end, the two small debossed marks, the central brushed-brass NFC disc with a three-arc contactless wave, and the USB-C connector protruding at the right end. Preserve the EXACT object in the attached reference image; do not restyle the product. Soft even large-softbox lighting, NO coloured rim light, NO dramatic shadows, only a subtle soft contact shadow, true-to-material colour (matte black glass-filled-nylon body, brushed brass disc, nickel-steel USB-C). Sharp focus edge to edge, catalogue reference plate, centered with even margins. Object geometry must match this spec exactly:\n\n{cad}"
  },
  "reference": "reference/toughkey-target.png",
  "output": {
    "imgtype": "plate",
    "aspect_ratio": "4:3",
    "resolution": "2k"
  },
  "engine": { "name": "higgsfield", "model": "nano_banana_2" }
}
